{
  "$schema": "https://json-schema.org/draft/2020-12/schema",
  "$id": "https://github.com/allsmog/vuln-scout/blob/main/whitebox-pentest/references/findings.schema.json",
  "title": "VulnScout Findings Artifact",
  "type": "object",
  "required": [
    "schema_version",
    "scan_id",
    "project_path",
    "completed_at",
    "source_tool",
    "summary",
    "findings"
  ],
  "properties": {
    "schema_version": {
      "type": "string",
      "const": "1.0.0"
    },
    "scan_id": {
      "type": "string"
    },
    "project_path": {
      "type": "string"
    },
    "completed_at": {
      "type": "string"
    },
    "source_tool": {
      "type": "string"
    },
    "coverage": {
      "type": "object"
    },
    "verification": {
      "type": "object"
    },
    "summary": {
      "type": "object",
      "required": [
        "total_findings",
        "total_hotspots",
        "critical",
        "high",
        "medium",
        "low",
        "info"
      ],
      "properties": {
        "total_findings": {
          "type": "integer",
          "minimum": 0
        },
        "total_hotspots": {
          "type": "integer",
          "minimum": 0
        },
        "critical": {
          "type": "integer",
          "minimum": 0
        },
        "high": {
          "type": "integer",
          "minimum": 0
        },
        "medium": {
          "type": "integer",
          "minimum": 0
        },
        "low": {
          "type": "integer",
          "minimum": 0
        },
        "info": {
          "type": "integer",
          "minimum": 0
        }
      }
    },
    "findings": {
      "type": "array",
      "items": {
        "type": "object",
        "required": [
          "id",
          "stable_key",
          "kind",
          "severity",
          "type",
          "title",
          "file",
          "line",
          "verdict",
          "confidence",
          "source_tool",
          "message",
          "evidence"
        ],
        "properties": {
          "id": {
            "type": "string"
          },
          "stable_key": {
            "type": "string"
          },
          "kind": {
            "type": "string",
            "enum": [
              "finding",
              "hotspot"
            ]
          },
          "severity": {
            "type": "string",
            "enum": [
              "critical",
              "high",
              "medium",
              "low",
              "info"
            ]
          },
          "type": {
            "type": "string"
          },
          "title": {
            "type": "string"
          },
          "file": {
            "type": "string"
          },
          "line": {
            "type": "integer",
            "minimum": 0
          },
          "rule_id": {
            "type": "string"
          },
          "cwe": {
            "type": "string"
          },
          "verdict": {
            "type": "string",
            "enum": [
              "verified",
              "false_positive",
              "needs_review",
              "unverified",
              "na_cpg"
            ]
          },
          "confidence": {
            "type": "string",
            "enum": [
              "verified",
              "high",
              "medium",
              "low"
            ]
          },
          "source_tool": {
            "type": "string"
          },
          "message": {
            "type": "string"
          },
          "remediation": {
            "type": "string"
          },
          "in_diff": {
            "type": "boolean"
          },
          "dynamic_verified": {
            "type": "boolean"
          },
          "suppressed": {
            "type": "boolean"
          },
          "suppression_reason": {
            "type": "string"
          },
          "evidence": {
            "type": "array",
            "minItems": 1,
            "items": {
              "type": "object",
              "required": [
                "type",
                "label",
                "path",
                "line",
                "excerpt"
              ],
              "properties": {
                "type": {
                  "type": "string"
                },
                "label": {
                  "type": "string"
                },
                "path": {
                  "type": "string"
                },
                "line": {
                  "type": "integer",
                  "minimum": 0
                },
                "excerpt": {
                  "type": "string"
                }
              }
            }
          }
        }
      }
    }
  }
}
